{
  "v": 1,
  "device_id": "d_9f3ac2",
  "device_kind": "desktop",
  "sent_at": "2026-10-03T14:00:00Z",
  "events": [
    {
      "id": "e_1f1e2d3c4b5a69788796a5b4c3d2e1f0",
      "seq": 4822,
      "ts": "2026-10-03T13:59:42Z",
      "type": "activity",
      "data": { "kind": "app", "app": "B 站", "category": "media" }
    }
  ]
}
